text,hashtags,Negative_score,Neutral_score,Positive_score,Compound_score,Sentiment
indian food food foodie indianfood odiafood desifood ad bbnaija commonwealthgames2022 donbelle femboy forever1 goldmedal harghartiranga imlie india jeffbarcode loveisland mufc monkeypox nsfwtwt onstorm pelosi r4today taiwan china india,"['food', 'foodie', 'indianfood', 'odiafood', 'desifood', 'ad', 'BBNaija', 'CommonwealthGames2022', 'DonBelle', 'femboy', 'FOREVER1', 'GoldMedal', 'HarGharTiranga', 'Imlie', 'India_With_爐爐萎踱伍踱', 'JeffBarcode', 'LoveIsland', 'MUFC', 'monkeypox', 'nsfwtwt', 'onstorm', 'Pelosi', 'r4today', 'Taiwan', 'China', 'India']",0.0,1.0,0.0,0.0,Neutral
disgusting behavior jacques,[],0.363,0.637,0.0,-0.6776,Negative
yeah say im saying said said still feeling watch made clear even though acted like dick take back amp got greg dumped later joanne karma finest,[],0.094,0.822,0.085,-0.3716,Negative
dont come acting like appreciate adhd talk youre make bully behavior appear normal many time gon na joke loveisland,['LoveIsland'],0.079,0.739,0.182,0.4939,Positive
character defending ekin su felt like loveisland,['LoveIsland'],0.0,0.772,0.228,0.5023,Positive
jacques real issue chronic bully loveisland,['loveisland'],0.262,0.738,0.0,-0.4939,Negative
lewys right yt vid abt ppl slating paige moving adam jacques asif jacques rlly disrespectful compared adam loveisland,[],0.0,1.0,0.0,0.0,Neutral
undisputed scottadkins lameckramses5 trump loveisland,"['scottadkins', 'lameckramses5', 'Trump', 'LoveIsland']",0.0,1.0,0.0,0.0,Neutral
year choose peace always see bitter tweet bitch ekinde though tell single looking love im gon na avoid loveisland,['LoveIsland'],0.209,0.62,0.171,-0.1915,Negative
honestly embarrassed many time refreshed ekin su insta today loveisland,['LoveIsland'],0.135,0.703,0.162,0.128,Neutral
jacques mocking tasha private story disgusting coward move week ago advocating mental health loveisland,['LoveIsland'],0.216,0.716,0.067,-0.6994,Negative
girl leave david please show actually suck find someone actually respect 10x hotter loveisland,['LoveIsland'],0.123,0.696,0.181,0.4168,Positive
think monkey pox started loveisland,['LoveIsland'],0.0,1.0,0.0,0.0,Neutral
heard say went ask ready go hideaway said said whilst back happened hear stormed z immediate excuse ran say typical men,[],0.037,0.9,0.063,0.1531,Neutral
jacques said mental health matter unless tasha loveisland,['loveisland'],0.0,0.891,0.109,0.0258,Neutral
queen unseen bit loveisland,['LoveIsland'],0.0,1.0,0.0,0.0,Neutral
genuinely cant believe tasha andrew going finish 2nd love island mentally abused fuck 3 week imagine uproar country fucked loveislanduk loveisland2022 loveisland,[],0.218,0.7,0.082,-0.7906,Negative
amount tweet saw attacking getting know adam make clear jacques left gon na get know anyway loveisland,['loveisland'],0.084,0.843,0.073,-0.1027,Negative
whether like paige clear yet another example season hugely misogynistic treated moving think forgotten luca shady comment implying left even loveisland,['loveisland'],0.078,0.875,0.048,-0.1491,Negative
grim man fucking smirk bekind tho yeah wait see telly loveisland,"['bekind', 'loveisland']",0.177,0.733,0.09,-0.4859,Negative
way saying wasnt weak saying clearly said used excuse maura went really going weak men would even dare speak truth infront boy including ur fav michael,[],0.022,0.743,0.235,0.9344,Positive
loveisland proving wrong luca bc literally idk many time shown luca literally got bad edit everyone refuse believe,['LoveIsland'],0.274,0.726,0.0,-0.8481,Negative
people wonder tasha cry lot villa constant pressure bully jacques luka dami stand friend everyone crap everyday loveisland,[],0.168,0.769,0.063,-0.6369,Negative
disgusting behavior jacques advocating mental health week ago hypocrite loveisland jacques tashaghouri,"['LoveIsland', 'jacques', 'TashaGhouri']",0.171,0.829,0.0,-0.6289,Negative
hope fake tbh left show long time ago still carry bullying keep nasty comment even opinion something pretty sure nice way around saying something kmt loveisland,['LoveIsland'],0.171,0.63,0.199,0.1761,Neutral
supposedly took mate would sat relying back use ur brain better kind rest anti feminist twitter weird x,[],0.081,0.791,0.128,0.5106,Positive
nah jacques audacity call tasha liar speech andrew loveisland,['loveisland'],0.239,0.761,0.0,-0.5719,Negative
watch,[],0.0,1.0,0.0,0.0,Neutral
wonder islander saw eachother originally flying mallorca feel like would plausible overlap airpoloveisland,['Loveisland'],0.0,0.915,0.085,0.3612,Positive
loveisland still trending two day later reminding u much miss seeing everyday,['LoveIsland'],0.091,0.909,0.0,-0.1531,Negative
back ice tunnel go finish smol project made well try visit far east section loveisland smp 9pm gmt 8 today ive cutting wayy much wood vtubers myvtuber envtuber vtuberen myvt,[],0.042,0.958,0.0,-0.2003,Negative
indiyah 600k feel right tbh go follow loveisland indiyah loveislandusa damiyah,"['LoveIsland', 'Indiyah', 'loveislandusa', 'Damiyah']",0.0,1.0,0.0,0.0,Neutral
damiyah third place get guy spin show asap loveisland,"['Damiyah', 'LoveIsland']",0.0,1.0,0.0,0.0,Neutral
may best heartbreaker win loveisland damiyah,"['LoveIsland', 'Damiyah']",0.186,0.349,0.465,0.7003,Positive
